439.0,3,58.87,3,Poznań Jeżyce ul. Dąbrowskiego,Rozkładowe jasne mieszkanie na trzecim piętrze w bloku mieszkalnym w Poznaniu w dzielnicy Jeżyce. Trzy pokoje okna wychodzące na wschód; widok na podwórko. Standard wykończenia: Ściany - gładź gipsowa; Podłogi - panele podłogowe terakota;..., trzecie
319.0,3,74.0,3,Poznań Naramowice ul. Naramowicka 203,Jasne przestronne mieszkanie ze skosami w nowszym budynku (2000r - budowa). III piętro 61 m2 użytkowej a całkowitej ok.74m2. Duży salon z prostym oknem i z wyjściem na balkon od strony południowej. W salonie dwie duże zabudowy. Dwie sypialnie..., trzecie
299.233,3,49.46,3,Poznań Winogrady ul. Hawelańska,Osiedle Nowe Winogrady zbudowaliśmy w północnej części Poznania w sąsiedztwie największego w mieście parku Cytadela i terenów rekreacyjnych nad Wartą. Pasjonaci historii mogą zwiedzać pobliskie stare forty z muzeami militariów. Lokalizacja..., trzecie
245.0,3,48.0,3,Poznań Grunwald,Polecamy na sprzedaż mieszkanie 3 pokojowe na Grunwaldzie przy ulicy Bułgarskiej znajdujące się na 3 pietrze w niskim bloku.Mieszkanie gotowe do wprowadzenia. Kuchnia - nowe szafki nowa zarówno kuchenka jak i lodówka łazienka w kafelkach pokoje..., trzecie
329.0,2,64.8,3,Poznań Wilda ul. Sikorskiego,Polecam na sprzedaż mieszkanie położone na trzecim piętrze w zrewitalizowanej kamienicy na ul. Sikorskiego. Kamienica z cegły ocieplona położona w okolicy Rynku Wildeckiego. Mieszkanie o pow. 64 86m2 składa się z przestronnego i bardzo..., trzecie
320.0,3,62.8,3,Poznań Piątkowo ul. Sobieskiego,Ciche mieszkanie na czwartym piętrze w bloku mieszkalnym w Poznaniu w dzielnicy Piątkowo. Trzy pokoje okna wychodzące na wschód zachód; widok na park. Standard wykończenia: Ściany - gładź gipsowa; Podłogi - panele podłogowe; Okna - PCV;..., trzecie
300.0,2,40.0,3,Poznań Stare Miasto ul. Piekary,Polecam na sprzedaż 2 pokojowe w samym centrum Poznania w nowym budownictwie ATANER o powierzchni 40 m2. Lokal składa się z dużego pokoju z aneksem kuchennym z wyjściem na balkon mniejszego pokoju łazienki z wanna. Blisko do przystanków..., trzecie
320.0,3,53.55,3,Poznań Piątkowo ul. Powstańców Warszawy,Ciche mieszkanie na trzecim piętrze w bloku mieszkalnym w Poznaniu w dzielnicy Piątkowo. Trzy pokoje z aneksem kuchennym okna wychodzące na północ południe wschód; widok na podwórko. Standard wykończenia: Ściany - glazura gładź gipsowa;..., trzecie
99.0,2,45.0,3,Poznań ul. Folwarczna,MIESZKANIE-TBS!!! 2 pokoje 45m2 99.000zł Cena do negocjacji !!! Zapraszam do zapoznania się z ofertą sprzedaży mieszkania położonego na ul.Folwarcznej w Poznaniu położone na spokojnym zadbanym osiedlu z doskonałą komunikacją miejską.W..., trzecie
320.0,2,55.0,3,Poznań Stare Miasto ul. Aleje Karola Marcinkowskiego,Jasne mieszkanie na trzecim piętrze w kamienicy w Poznaniu w dzielnicy Stare Miasto. Idealne nadaje się na kancelarię. Dwa pokoje okna wychodzące na wschód; widok na inne budynki. Standard wykończenia: Ściany - tynk glazura; Podłogi - panele..., trzecie
189.0,2,42.5,3,Poznań Nowe Miasto ul. Starołęka Głuszyna,Zapraszam do zapoznania się z ofertą sprzedaży mieszkania w spokojnej i zielonej okolicy Poznania. Świetna cena oraz komfortowe warunki mieszkania to główne atuty nieruchomości. Nieruchomość spełnia warunki przewidziane w programie MDM...., trzecie
245.0,2,48.0,3,Poznań Winogrady Piątkowo Centrum ul. Piątkowska,Polecam na sprzedaż mieszkanie zlokalizowane na Poznańskich Winogradach przy ul. Piątkowskiej. Mieści się na 3 piętrze w bloku z windą. Na metraż 48m2 składa się: - z dwóch niezależnych pokoi ściany wygładzone (na podłodze panele) - osobnej..., trzecie
239.0,1,37.0,3,Poznań Stare Miasto Piątkowo ul. Os.Batorego Niski Blok,Kawalerka 37 00m2 239.000zł cena do negocjacji!!! Zapraszam do zapoznania się z ofertą sprzedaży mieszkania położonego w dzielnicy Stare Miasto - Piątkowo w bloku 3 piętrowym na 3-cim piętrze. Mieszkanie o powierzchni 37 00m2 obejmuje:jeden duży..., trzecie
449.0,4,107.0,3,Poznań Jezyce ul. Jeżycka,Witam i polecam przestronne mieszkanie 4 pokojowe na Jeżycach - przy ul. Jeżyckiej. Mieszkanie w budynku z cegły- kamienica z lat przedwojennych- w trakcie rewitalizacji lokal na 3 piętrze-w budynku 4 piętrowym (użytkowe poddasze przerobione..., trzecie
300.0,2,42.0,3,Poznań Wilda ul. Czeremchowa,Zachęcam do zakupu - bez pośredników od właściciela – 42-metrowego mieszkania wraz z bogatym wyposażeniem. Położone jest w Poznaniu w spokojnej okolicy złożonej głównie z domów jednorodzinnych w dzielnicy Wilda na północno-wschodnim skraju..., trzecie
305.0,3,62.0,3,Poznań Rataje Centrum ul. Powstań Narodowych Os.,Polecam na sprzedaż mieszkanie znajdujące się na os. Powstańców Narodowych gotowe do zamieszkania bez żadnych dodatkowych kosztów. Piękne jasne bardzo zadbane przestronne ustawne mieszkanie w cichym miejscu osiedla z otwartym widokiem ..., trzecie
499.0,4,96.0,3,Poznań Rataje ul. Os. Stare Żegrze,Jestem 1. właścicielem. Pod 501718122 proszę dzwonić między godz. 8-20., trzecie
326.76099999999997,3,54.01,3,Poznań Winogrady ul. Hawelańska,Osiedle Nowe Winogrady zbudowaliśmy w północnej części Poznania w sąsiedztwie największego w mieście parku Cytadela i terenów rekreacyjnych nad Wartą. Pasjonaci historii mogą zwiedzać pobliskie stare forty z muzeami militariów. Lokalizacja..., trzecie
216.0,3,45.0,3,Poznań Grunwald ul. Bukowska/Swoboda,Polecam na sprzedaż mieszkanie o pow.45m2 położone przy ul.Bukowska/Swoboda w niskim odnowionym bloku na trzecim piętrze z balkonem. Mieszkanie składa się z trzech pokoi (17 11 8). Z największego pokoju wchodzi się do jasnej umeblowanej kuchni...., trzecie
465.664,3,68.48,3,Poznań Nowe Miasto ul. Mogileńska,Osiedle Nowa Malta zlokalizowane jest we wschodniej części miasta tuż przy jeziorze Maltańskim. Z jednej strony inwestycja ma dostęp do licznych terenów zielonych a z drugiej szybki i prosty dojazd do centrum ulicą Warszawską. W pobliżu osiedla..., trzecie
435.0,4,80.0,3,Poznań Piątkowo ul. Os.Jagiełły,PIĄTKOWO - os. Jagiełły - super położenie w środku osiedla a jednocześnie bardzo blisko komunikacji miejskiej w najbliższej okolicy sklepy apteka szkoła przedszkole poczta itp. Polecam do sprzedaży bardzo ładne jasne przestronne mieszkanie..., trzecie
572.0,2,59.0,3,Poznań Grunwald,Polecamy na sprzedaż w pełni wyposażone i umeblowane mieszkanie w prestiżowej lokalizacji Poznania. Lokal znajduje się w nowoczesnym kompleksie apartamentowców gdzie znajdują się liczne restauracje kawiarnie casino salony urody gabinety..., trzecie
450.0,2,45.0,3,Poznań Rataje,Szanowni Państwo Jako właściciel Biura Nieruchomości EURO-dom.CO oferuję Państwu profesjonalne i skuteczne usługi pośrednictwa w obrocie nieruchomościami. Nasz zespół to Pośrednicy Prawnik Biegły Rewident Podatkowy Agent Ubezpieczeniowy...., trzecie
385.0,3,90.2,3,Poznań Poznań-Grunwald ul. Śniadeckich,Przestronne wysokie mieszkanie usytuowane w poblizu Palmiarni i MPT. Kamienica w bardzo dobrej kondycji technicznej odremontowane klatki zagospodarowane tereny przynalezne wokół. Lokal ma wschodnio-zachodnią wystawę okien wygodny balkon nową..., trzecie
449.0,3,65.0,3,Poznań Naramowice ul. Naramowicka,Polecam mieszkanie na sprzedaż w nowym bloku z 2006 roku. Lokal położony jest na 3 piętrze. W budynku jest winda która jest bezpośrednio połączona z podziemiem gdzie znajdują się miejsca postojowe oraz dodatkowe pomieszczenia gospodarcze...., trzecie
460.0,3,69.3,3,Poznań Naramowice ul. Karpia,Ciche mieszkanie na trzecim piętrze w bloku mieszkalnym w Poznaniu w dzielnicy Naramowice. Trzy pokoje okna wychodzące na południe wschód zachód; widok na inne budynki. Standard wykończenia: Ściany - glazura gładź gipsowa; Podłogi - deska..., trzecie
245.0,1,34.0,3,Poznań Piątkowo ul. Teofila Mateckiego,Gorąco polecam na sprzedaż kawalerkę o podwyższonym standardzie w dobrze skomunikowanej dzielnicy Poznania. Mieszkanie mieści się na trzecim piętrze czteropiętrowego budynku z windą. Blok z 2010 roku. Lokal składa się z dużego jasnego salonu z w..., trzecie
310.0,3,64.0,3,Poznań Piątkowo ul. Bolesława Śmiałego,Piątkowo - Bolesława Śmiałego niski blok. Funkcjonalne mieszkanie 3-pokoje - 63 9m2 Zaletą nieruchomości są jej lokalizacja i 3 pokoje na 3 piętrze. Bardzo dobra komunikacja z centrum miasta - 3 minuty do Pestki. Zielone osiedle w pobliżu..., trzecie
106.0,2,52.0,3,Poznań Koziegłowy ul. Os. Leśne,MIESZKANIE-TBS!!! 2 pokoje 52 4m2 106.000zł Cena do negocjacji !!! Zapraszam do zapoznania się z ofertą sprzedaży mieszkania położonego na os. Leśnym w Koziegłowach położone na spokojnym zadbanym osiedlu z doskonałą komunikacją miejską..., trzecie
372.6,3,54.0,3,Poznań Stare Miasto Centrum,3 POKOJOWE MIESZKANIE - ŚCISŁE CENTRUM POZNANIA/ RYNEK/GARBARY - MOŻLIWOŚĆ WYDZIELENIA 3 KAWALEREK! Główne atuty nieruchomości: • prestiżowa lokalizacja Nieruchomość złożona z: • pokój 10 m.kw • pokój 10 m.kw • pokój 17 m.kw • łazienka 4 m.kw..., trzecie
290.0,3,53.55,3,Poznań Jeżyce ul. Os. Powstańców Warszawy Piątkowska,Biuro Nieruchomości Credo poleca na sprzedaż mieszkanie 3-pokojowe o powierzchni całkowitej 53 55 m2 usytuowane na 3 piętrze w niskim bloku z 1996 roku zlokalizowane na Os. Powstańców Warszawy. Do mieszkania przynależy piwnica ok 2 48 m2. Dookoła..., trzecie
420.0,4,100.1,3,Poznań Łazarz ul. Głogowska,Polecam na sprzedaż duże 4-pokojowe mieszkanie na poznańskim Łazarzu. Lokal zajmuje powierzchnię 100 mkw. i położony jest na 3. piętrze kamienicy z windą. Składa się z 4 niezależnych pokoi jasnej oddzielnej kuchni łazienki i przedpokoju...., trzecie
409.401,3,69.39,3,Poznań Grunwald ul. Knapowskiego 25,Lokal mieszkalny numer 15 o powierzchni 69 39 m2 składa się z pokoju dziennego dwóch pokoi kuchni łazienki i korytarza. Mieszkanie posiada balkon. Mieszkanie jest położone na III piętrze od strony południowo-wschodniej i północno-zachodniej...., trzecie
237.0,2,40.0,3,Poznań Grunwald ul. Łukaszewicza,Serdecznie polecam do sprzedaży mieszkanie położone w cichej i spokojnej okolicy na ul.Łukaszewicza. Mieszkanie o dokładnym metrażu 39 6 mkw składa się z dwóch pokoi kuchni łazienki oraz przedpokoju. Znajduję się na 3 piętrze niskiego bloku z..., trzecie
360.36199999999997,3,55.87,3,Poznań Winogrady ul. Hawelańska,Osiedle Nowe Winogrady zbudowaliśmy w północnej części Poznania w sąsiedztwie największego w mieście parku Cytadela i terenów rekreacyjnych nad Wartą. Pasjonaci historii mogą zwiedzać pobliskie stare forty z muzeami militariów. Lokalizacja..., trzecie
455.0,4,88.7,3,Poznań Rataje ul. Osiedle Stare Żegrze,Polecam na sprzedaż duże 4-pokojowe mieszkanie na poznańskich Ratajach. Lokal o powierzchni niespełna 89 mkw. położony jest na 3. piętrze niskiego bloku z cegły zbudowanego pod koniec lat 90. Składa się z 4 pokoi (salonu połączonego z jasną..., trzecie
250.0,2,45.0,3,Poznań Grunwald Górczyn ul. Górki,Mieszkanie 2-pokojowe 45 m2 na 3 w 5-cio piętrowym bloku przy ul. Górki na Górczynie. Mieszkanie składa się z pokoju dziennego z aneksem pokoju samodzielnego (o pow. ok. 11 m2) aneksu kuchennego oraz łazienki z wanną i WC. Pokoje ustawne...., trzecie
257.0,2,51.94,3,Poznań Luboń ul. Wschodnia,Polecam na sprzedaż 2 pokojowe mieszkanie położone w Luboniu przy ul. Wschodniej. Mieszkanie o powierzchni 51 94m2 obejmuje: pokoje 18m2 z dużym balkonem 12m2 częściowo otwartą kuchnię z jadalnią łazienka z wc z kabiną prysznicową. W..., trzecie
398.0,3,97.87,3,Poznań Grunwald ul. Bukowska,Polecam na sprzedaż ustawne 3 pokojowe mieszkanie na 3 piętrze kamienicy z lat 30-tych XX w. Składa się ono z salonu (z działającym kominkiem) 2 przestronnych sypialni oddzielnej kuchni z zabudową łazienki (z oknem) oraz przedpokoju. Pokoje (..., trzecie
261.0,2,44.3,3,Poznań Centrum ul. Św.Marcin,Polecam do kupna mieszkanie położone w samym centrum Poznania przy ul.Św .Marcin w bloku o ciekawej architekturze z lat 60-tych. Mieszkanie położone na 3 piętrze -jest winda duże okna z pięknym widokiem na centrum w całym mieszkaniu na podłodze..., trzecie
220.0,2,38.0,3,Poznań Grunwald Wilda Jeżyce ul. Bułgarska,Polecam na sprzedaż mieszkanie 2-pokojowe z jasną kuchnią umeblowane biurka łóżko kanapa szafki znajdujące się w bloku na 3 piętrze przy ul. Bułgarskiej. Blok odnowiony (na klatce i w piwnicy na podłodze kafelki) ocieplony monitorowany DO..., trzecie
353.395,3,58.0,3,Poznań Winogrady Piątkowo Naramowice Stare Miast ul. Wilczak,KUPUJĄCY NIE PŁACI PROWIZJI. Na sprzedaż mieszkanie 3-pokojowe na nowym osiedlu Wilczak. Mieszkanie usytuowane jest na 3 piętrze w budynku jest winda. Układ pomieszczeń: pokój dzienny z aneksem kuchennym (25 58m2) z balkonem (4 86m2) 2 sypialnie..., trzecie
450.0,4,124.0,3,Poznań Grunwald ul. Ul. Skryta,Zapraszam do zapoznania się z ofertą sprzedaży mieszkania położonego na Grunwaldzie przy ul. Skrytej (boczna od ulicy Matejki) bardzo blisko centrum. Ciekawa oferta dla osób ceniących ciszę i spokój ale chcących zamieszkać w centrum miasta...., trzecie
255.84,2,42.64,3,Poznań Wilda ul. Rolna 37 I 39,Nieruchomości Mieszkania Nieruchomości Mieszkania, trzecie
730.0,4,104.0,3,Poznań Naramowice,Przedstawiamy Państwu ofertę zakupu pięknego i pięknie położonego na terenie zamkniętego i monitorowanego osiedla dwupoziomowego czteropokojowego mieszkania o powierzchni 104 m2 usytuowanego na 3/4 kondygnacji budynku z cegły wybudowanego..., trzecie
298.0,3,88.0,3,Poznań Centrum,| Kontakt w sprawie oferty: Renata tel. 790 721 421 Polecam na sprzedaż mieszkanie w kamienicy w centrum Poznania przy ul. Garbary / Wszystkich Św. / Mostowa o powierzchni ok. 88 m2 i wysokości 3 10 m. Nieruchomość znajduje się na 3 piętrze w..., trzecie
298.0,2,60.0,3,Poznań Stare Miasto Centrum ul. Rybaki,Na sprzedaż mieszkanie 60m2 na ul. Rybaki w samym centrum miasta. Mieszkanie znajduje się na w odrestaurowanej kamienicy. Wejście od dziedzinca przy kinie Malta. Urokliwa i piękna dzielnica. Metraż pomieszczeń jak i rzut mieszkania znajdują..., trzecie
278.0,2,51.8,3,Poznań Stare Miasto Centrum ul. Ratajczaka,Dwupokojowe mieszkanie w ścisłym centrum Poznania. Główne atuty nieruchomości: • prestiżowa lokalizacja • doskonała komunikacja z centrum • bliskość komunikacji miejskiej Nieruchomość złożona z: • pokój 17 m.kw • pokój 17 m.kw • kuchnia..., trzecie
300.425,2,49.25,3,Poznań Winogrady ul. Hawelańska,Nieruchomości Mieszkania Nieruchomości Mieszkania, trzecie
259.0,3,82.0,3,Poznań Wilda Dębiec Centrum Rataje Łazarz Grunwa ul. Rolna Hetmańska - Polecam Dobra Cena!!!,BEZPIECZNA TRANSAKCJA JEDYNIE Z DOŚWIADCZONYM I LICENCJONOWANYM POŚREDNIKIEM!!! 100 % SATYSFAKCJI Z ZAKUPU!!! Polecam do zakupu mieszkanie 3 pokojowe położone na Wildzie ( ul. Rolna / Hetmańska ). Na 82 m2 składają się trzy ustawne pokoje ..., trzecie
319.985,3,52.03,3,Poznań Winogrady ul. Hawelańska,Osiedle Nowe Winogrady zbudowaliśmy w północnej części Poznania w sąsiedztwie największego w mieście parku Cytadela i terenów rekreacyjnych nad Wartą. Pasjonaci historii mogą zwiedzać pobliskie stare forty z muzeami militariów. Lokalizacja..., trzecie
394.0,2,46.12,3,Poznań Nowe Miasto Rataje ul. Milczańska,Atrakcyjne i niepowtarzalne mieszkanie z antresolą na osiedlu zamkniętym na Ratajach. Główne atuty nieruchomości: • prestiżowa lokalizacja • bliskość terenów zielonych • położenie z dala od głównej jezdni Nieruchomość złożona z: • pokój..., trzecie
307.0,3,63.0,3,Poznań Rataje Centrum Wilda Warszawskie ul. Powstań Narodowych,Zapraszam do obejrzenia zadbanego słonecznego 4 pokojowego mieszkania zlokalizowanego na 3 piętrze w niskim bloku w pięknej zielonej okolicy poznańskich Rataj. Pełen metraż to 63m2 składają się na niego 4 ustawne pokoje (metraże: 14m2 6m2 ..., trzecie
315.0,3,52.0,3,Poznań Jeżyce,Polecam mieszkanie położone na ul. Wojska Polskiego bardzo spokojna okolica. Mieszkanie położone w odnowionym bloku z lat 60. Mieszkanie trzypokojowe o powierzchni 52m2 ( powierzchnia liczona po podłodze jest większa). Mieszkanie składa się..., trzecie
200.0,1,30.8,3,Poznań Podolany Jeżyce ul. Edwarda Raczyńskiego,BEZPIECZNA TRANSAKCJA TYLKO Z LICENCJONOWANYM POŚREDNIKIEM!!! Na sprzedaż komfortowa kawalerka z BALKONEM PO REMONCIE! Mieszkanie (30 80m2) znajduje się przy ul. Edwarda Raczyńskiego na 3 piętrze niskiego bloku i składa się z: - pokoju z..., trzecie
305.0,4,62.0,3,Poznań Rataje ul. Powstań Narodowych,Pierwszy właściciel. Pełna własność księga wieczysta z gruntem. Gotowe do zamieszkania bez żadnych dodatkowych kosztów. Piękne jasne bardzo zadbane przestronne ustawne mieszkanie w cichym miejscu osiedla z otwartym widokiem ekspozycja..., trzecie
390.0,3,89.0,3,Poznań Górczyn ul. Hetmańska,Polecam na sprzedaż mieszkanie o pow. 89 m2 zlokalizowane w przedwojennej kamienicy przy ul. Hetmańskiej w pobliżu ul. Głogowskiej. Na jego powierzchnię składają się 3 ustawne i przestronne pokoje korytarz łazienka oraz jasna w pełni wyposażona..., trzecie
721.2760000000001,4,106.07,3,Poznań Wilda ul. Św. Czesława,Oferta ekskluzywnie wykończonego apartamentowca w samym sercu Poznania. Lokalizacja pozwala na korzystanie ze wszystkich udogodnień jakie oferuje centrum miasta. Na chwilę obecną dostępne są duże apartamenty w tym jeden dwu-poziomowy.Link do..., trzecie
262.362,2,43.38,3,Poznań Winogrady ul. Hawelańska,Osiedle Nowe Winogrady zbudowaliśmy w północnej części Poznania w sąsiedztwie największego w mieście parku Cytadela i terenów rekreacyjnych nad Wartą. Pasjonaci historii mogą zwiedzać pobliskie stare forty z muzeami militariów. Lokalizacja..., trzecie
260.842,2,40.0,3,Poznań Grunwald ul. Kamiennogórska,Mieszkać wśród spokojnej zieleni czy dać się porwać rytmowi miasta? Trudny wybór ale nie musi Cię dotyczyć jeśli zamieszkasz na Młodym Grunwaldzie! Poznaj miejsce dzięki któremu skorzystasz z wygód miasta i ciszy Lasku Marcelińskiego! Zrób..., trzecie
315.0,4,100.0,3,Poznań Stare Miasto ul. Hulewiczów,Polecam na sprzedaż 2-pokojowe mieszkanie 46m2. Własnościowe z księgą wieczystą. Klatka schodowa czysta i zadbana. Mieszkanie jest bardzo ciche ciepłe i jasne . Cena: 315 000 Umeblowanie takie jak na zdjęciach. W cenie pozostaje zabudowa..., trzecie
307.0,3,65.0,3,Poznań Piątkowo ul. Osiedle Stefana Batorego,Kupując z pośrednikiem - kupujesz bezpiecznie z ubezpieczeniem od odpowiedzialności cywilnej od transakcji OFERTA DOSTĘPNA W PROGRAMIE MDM !!! Witam i polecam uwadze mieszkanie połozone w Poznaniu na osiedlu Stefana BATOREGO (2 min do Pestki)..., trzecie
325.0,3,63.8,3,Poznań Dębiec ul. Os. Dębina,Rozkładowe przestronne mieszkanie na trzecim piętrze w bloku mieszkalnym w Poznaniu w dzielnicy Dębiec. Trzy pokoje okna wychodzące na wschód zachód; widok na inne budynki. Standard wykończenia: Ściany - glazura gładź gipsowa; Podłogi -..., trzecie
265.0,3,48.0,3,Poznań Rataje ul. Os. Bohaterów Ii Wojny Światowej,Mieszkanie na sprzedaż pow. ok 48m2 trzy pokoje Poznań Rataje Osiedle Bohaterów II Wojny Światowej 3 piętro niski ocieplony blok okna PCV loggia mieszkanie rozkładowe wschód zachód trzy niezależne pokoje 16 9 7m2 z większego pokoju..., trzecie
245.0,3,48.0,3,Poznań Grunwald Centrum ul. Bułgarska,Polecam na sprzedaż mieszkanie 3 pokojowe zlokalizowane przy ul. Bułgarskiej na Poznańskim Grunwaldzie. Na metraż 48m2 składa się z 2 pokoi salonu jasnej kuchni łazienki oraz przedpokoju. Gotowe do zamieszkania. Kuchnia nowe szafki kuchenka..., trzecie
250.0,2,45.0,3,Poznań Górczyn Grunwald Łazarz ul. Górki,POLECAM NA SPRZEDAŻ mieszkanie o łącznej powierzchni ok. 45 m2 składające się z salonu z aneksem kuchennym sypialni (10m2) łazienki i przedpokoju. Usytuowane jest na 3 piętrze 5 kondygnacyjnego monitorowanego budynku z windą oraz halą..., trzecie
244.9,2,52.0,3,Poznań Suchy Las ul. Poziomkowe Os.,Polecam na sprzedaż o wygodne przytulne i jasne mieszkania położone w Suchym Lesie na osiedlu Poziomkowym. W bliskim otoczeniu znajdują się: komunikacja miejska nowoczesne przedszkola szkoły hale sportową fitness basen nowy dom kultury ..., trzecie
235.0,2,38.0,3,Poznań Sołacz ul. Urbanowska,Rozkładowe jasne mieszkanie na trzecim piętrze w bloku mieszkalnym w Poznaniu w dzielnicy Sołacz. Dwa pokoje z aneksem kuchennym okna wychodzące na południe; widok na inne budynki. Standard wykończenia: Ściany - glazura gładź gipsowa;..., trzecie
329.634,2,57.05,3,Poznań Malta,| OSTATNIE WOLNE LOKALE! MALTA FOUNTAIN Nowoczesny sześciokondygnacyjny budynek w atrakcyjnej części Poznania przy ul. Milczańskiej 1. Na kompleks składa się 129 mieszkań o powierzchniach od 26 66m2 - 115 38m2. Przemyślane rozkłady..., trzecie
308.066,3,50.92,3,Poznań Winogrady ul. Hawelańska,Osiedle Nowe Winogrady zbudowaliśmy w północnej części Poznania w sąsiedztwie największego w mieście parku Cytadela i terenów rekreacyjnych nad Wartą. Pasjonaci historii mogą zwiedzać pobliskie stare forty z muzeami militariów. Lokalizacja..., trzecie
328.60699999999997,3,53.87,3,Poznań Winogrady ul. Hawelańska,Nieruchomości Mieszkania Nieruchomości Mieszkania, trzecie
379.0,2,54.6,3,Poznań,Polecam na sprzedaż atrakcyjne mieszkanie z balkonem znajdujące się na Grunwalddzie. Główne atuty nieruchomości: • bliskość komunikacji miejskiej • rozkład pomieszczeń • w pełni wykończony lokal Nieruchomość złożona z: • salon 20 2 m.kw •..., trzecie
280.0,3,51.12,3,Poznań Grunwald ul. Raszyńska,| DoradcaRN poleca do zakupu bardzo zadbane urządzone 2-pokojowe mieszkanie przy ul. Raszyńskiej na Grunwaldzie w Poznaniu. III piętro ostatnie - niski blok z cegły. KUPUJĄCY NIE PŁACI PROWIZJI. Wynagrodzenie pośrednika pokrywa sprzedający...., trzecie
234.0,2,40.0,3,Poznań Łazarz ul. Łukaszewicza 29,Sprzedam dwupokojowe mieszkanie przy ul. Łukaszewicza. Mieszkanie o powierzchni 39 6 m2 dwa samodzielne pokoje osobna jasna kuchnia 3 piętro pełna własność. Do mieszkania przynależy piwnica. Budynek po remoncie kapitalnym dachu w następnym..., trzecie
360.0,2,52.0,3,Poznań Grunwald ul. Szamarzewskiego,Okazja mieszkanie bezczynszowe! Witam i polecam unikatowe mieszkanie 2 pokojowe na pograniczu Grunwaldu i Jeżyc- w pobliżu ul. Szamarzewskiego. Mieszkanie mieści się na parterze willi miejskiej budynek ogrodzony i otynkowany po..., trzecie
199.0,2,29.0,3,Poznań Grunwald ul. Bukowska/ Szamotulska,Polecam na sprzedaż mieszkanie dwupokojowe o powierzchni 29 m2 na Grunwaldzie rejon Bukowskiej a Szamotulskiej. Mieszkanie usytuowane jest na trzecim piętrze w niskim ocieplonym i odnowionym czteropiętrowym bloku. Mieszkanie składa się z pokoju..., trzecie
299.0,3,55.0,3,Poznań Stare Miasto Chwaliszewo ul. Chwaliszewo,Polecam na sprzedaż komfortowy apartament na Chwaliszewie. Mieszkanie zlokalizowane jest przy ulicy Chwaliszewo przy cichej uliczce nieopodal koryta Warty oraz Płyty Starego Rynku. Kamienica po rewitalizacji z nowym dachem nową elewacją w..., trzecie
203.0,2,37.0,3,Poznań Sołacz Jeżyce Bonin Piątkowo Winogrady Ce ul. Sokoła,Polecam na sprzedaż wygodne kompaktowe mieszkanie o powierzchni 37m2 na Sołaczu blisko parku i Akademii Rolniczej. Dwa pokoje kuchnia w aneksie (możliwość zamknięcia) łazienka spora garderoba/pomieszczenie gospodarcze korytarz...., trzecie
270.108,2,44.28,3,Poznań Winogrady ul. Hawelańska,Nieruchomości Mieszkania Nieruchomości Mieszkania, trzecie
300.39099999999996,2,54.5,3,Poznań Winogrady Piątkowo Naramowice Stare Miast ul. Wilczak Program Mieszkanie Dla Młodych,KUPUJĄCY NIE PŁACI PROWIZJI. MIESZKANIE W PROGRAMIE MDM. Na sprzedaż mieszkanie 2-pokojowe na nowym osiedlu Wilczak. Mieszkanie usytuowane jest na 3 piętrze w budynku jest winda. Układ pomieszczeń: pokój dzienny z aneksem kuchennym z oknem..., trzecie
245.0,3,48.3,3,Poznań Grunwald Grunwald,GOTOWE MIESZKANIE NA GRUNWALDZIE - 3 pokoje - okazja! Mieszkanie nie wymaga nakładów finansowych - jest gotowe do wprowadzenia . Pokoje odmalowano na podłogach w pokojach położono panele a w kuchni i łazience - płytki. Dodatkowo - kuchnia i..., trzecie
320.0,3,62.0,3,Poznań Piątkowo ul. Os. Jana Iii Sobieskiego,Polecam na sprzedaż mieszkanie 3-pokojowe usytuowane na Piątkowie na os. Jana III Sobieskiego. Mieszkanie po remoncie odświeżone gotowe do zamieszkania możliwy MDM!!!! Metraż 62 m2. Mieszkanie znajduje się na 3 piętrze w niskiej zabudowie...., trzecie
320.0,3,64.0,3,Poznań Piątkowo ul. Os. Chrobrego,Oferuję do sprzedania mieszkanie trzypokojowe położone na trzecim piętrze czteropiętrowego bloku na os. Chrobrego na poznańskim Piątkowie. Mieszkanie jest całkowicie w układzie niezależnym i do wszystkich pomieszczeń wchodzi się z korytarza. Lokal..., trzecie
307.0,3,64.9,3,Poznań Piątkowo,Polecam na sprzedaż piękne mieszkanie trzypokojowe z balkonem w bardzo dobrej lokalizacji!!! Mieszkanie znajduje się na 3 piętrze w 4 piętrowym bloku. W okolicy dogodne połączenie komunikacyjne. Lokal składa się z 2 sypialni salonu kuchni ..., trzecie
424.098,3,68.53,3,Poznań Grunwald ul. Gotowe Do Odbioru Jeleniogórska Mdm,3-POKOJOWE - GOTOWE DO ODBIORU nr mieszkania: F/86 cena brutto: 439.098 73 zł CENA PROMOCYJNA DO KOŃCA WRZEŚNIA: 424.098 73 zł BRUTTO kondygnacja: III piętro balkon: tak komórka lokatorska: 3 68 m2 wliczona w cenę mieszkania dodatkowe opcje: -..., trzecie
